{
  "clock_bridge_id": "clock-a7b426d3e48cf006",
  "discarded_initial_backlog_samples": 3,
  "offset_ns": 1784288774714835947,
  "rate_ratio": 1.048789369506925,
  "reasons": [],
  "reference_px4_us": 23538000,
  "reference_ros_ns": 1784288798252835947,
  "reset_count": 0,
  "residual_max_ns": 77969031,
  "residual_median_ns": 16967322,
  "sample_count": 30,
  "schema_version": "1.0",
  "segment_count": 1,
  "status": "VALID",
  "thresholds": {
    "degraded_residual_max_ns": 250000000,
    "maximum_round_trip_time_ns": 20000000,
    "maximum_timesync_offset_span_ns": 5000000,
    "minimum_sample_count": 20,
    "residual_max_ns": 100000000,
    "segment_jump_ns": 50000000
  },
  "timestamp_domains": {
    "source": "px4_boot_us",
    "target": "ros_node_ns"
  },
  "uncertainty_ns": 77969031,
  "valid_from": 13952000,
  "valid_until": 34896000
}
